{"base_site":{"path":"/secure/operator/azure-cpu-materializer-site.json","sha256":"aaaaaaaaaaaaaaaaaaaaaaaaaaaaaaaaaaaaaaaaaaaaaaaaaaaaaaaaaaaaaaaa","size_bytes":4096},"historical_goldbach":{"build_admission":{"path":"/secure/goldbach/goldbach-build-admission.json","sha256":"bbbbbbbbbbbbbbbbbbbbbbbbbbbbbbbbbbbbbbbbbbbbbbbbbbbbbbbbbbbbbbbb","size_bytes":4096},"child_identity_commitment":{"path":"/secure/goldbach/historical-child-commitment.json","sha256":"cccccccccccccccccccccccccccccccccccccccccccccccccccccccccccccccc","size_bytes":4096},"terminal_handoff":{"path":"/secure/goldbach/historical-terminal-handoff.tar","sha256":"dddddddddddddddddddddddddddddddddddddddddddddddddddddddddddddddd","size_bytes":1099511627776}},"kind":"sparkinterval.azure.cpu.helfgott-platt-goldbach-terminal-materializer-site.v1","schema_version":1}
